[
    { "model": 12, "position": [-32.0, 0.0, -136.0], "rotation": [0.0, 0.0, 0.0], "scale": [1.0, 1.0, 1.0] },
    { "model": 13, "position": [32.0, 0.0, -136.0], "rotation": [0.0, 0.0, 0.0], "scale": [1.0, 1.0, 1.0] },
    { "model": 23, "position": [120.0, 0.0, -72.0], "rotation": [0.0, 0.0, 0.0], "scale": [1.0, 1.0, 1.0] },
    { "model": 23, "position": [104.0, 0.0, -72.0], "rotation": [0.0, 0.0, 0.0], "scale": [1.0, 1.0, 1.0] },
    { "model": 23, "position": [-232.0, 0.0, -72.0], "rotation": [0.0, 0.0, 0.0], "scale": [1.0, 1.0, 1.0] },
    { "model": 23, "position": [-232.0, 0.0, -200.0], "rotation": [0.0, 0.0, 0.0], "scale": [1.0, 1.0, 1.0] },
    { "model": 44, "position": [104.0, 14.0, -184.0], "rotation": [0.0, 0.0, 0.0], "scale": [1.0, 1.0, 1.0] },
    { "model": 47, "position": [-232.0, 0.0, -160.0], "rotation": [0.0, 0.0, 0.0], "scale": [1.0, 1.0, 1.0] },
    { "model": 47, "position": [-232.0, 0.0, -112.0], "rotation": [0.0, 0.0, 0.0], "scale": [1.0, 1.0, 1.0] },
    { "model": 57, "position": [-8.0, 0.0, -104.0], "rotation": [0.0, 0.0, 0.0], "scale": [1.0, 1.0, 1.0] },
    { "model": 50, "position": [-176.0, 0.0, -160.0], "rotation": [0.0, 0.0, 0.0], "scale": [1.0, 1.0, 1.0] },
    { "model": 50, "position": [-112.0, 0.0, -160.0], "rotation": [0.0, 0.0, 0.0], "scale": [1.0, 1.0, 1.0] },
    { "model": 50, "position": [-112.0, 0.0, -112.0], "rotation": [0.0, 0.0, 0.0], "scale": [1.0, 1.0, 1.0] },
    { "model": 50, "position": [-176.0, 0.0, -112.0], "rotation": [0.0, 0.0, 0.0], "scale": [1.0, 1.0, 1.0] },
    { "model": 4, "position": [56.0, 0.0, -136.0], "rotation": [0.0, 0.0, 0.0], "scale": [1.0, 1.0, 1.0] },
    { "model": 4, "position": [-56.0, 0.0, -136.0], "rotation": [0.0, 0.0, 0.0], "scale": [1.0, 1.0, 1.0] },
    { "model": 52, "position": [104.0, 16.0, -136.0], "rotation": [0.0, 0.0, 0.0], "scale": [1.0, 1.0, 1.0] },
    { "model": 52, "position": [104.0, 16.0, -168.0], "rotation": [0.0, 0.0, 0.0], "scale": [1.0, 1.0, 1.0] },
    { "model": 58, "position": [8.0, 0.0, -104.0], "rotation": [0.0, 0.0, 0.0], "scale": [1.0, 1.0, 1.0] },
    { "model": 63, "position": [56.0, -1.0, -217.0], "rotation": [0.0, 0.0, 0.0], "scale": [1.0, 1.0, 1.0] }
]
